{
  "schemaVersion": 1,
  "academicYear": 2026,
  "timezone": "Asia/Tokyo",
  "source": [
    {
      "id": "official-calendar-2026",
      "title": "Science Tokyo 2026年度 授業日程",
      "url": "https://www.titech.ac.jp/student/students/life/schedules"
    }
  ],
  "entries": [
    {
      "id": "2026-04-01-academic-orientation",
      "startDate": "2026-04-01",
      "endDate": "2026-04-01",
      "label": {
        "ja": "新入生総合オリエンテーション（学士課程）",
        "en": "New Student General Orientation (Bachelor's Degree Program)"
      },
      "category": "academic",
      "sourceIds": [
        "official-calendar-2026"
      ],
      "labelEnglishSource": "translation"
    },
    {
      "id": "2026-04-02-ceremony-entrance",
      "startDate": "2026-04-02",
      "endDate": "2026-04-02",
      "label": {
        "ja": "入学式",
        "en": "Entrance Ceremony"
      },
      "category": "ceremony",
      "sourceIds": [
        "official-calendar-2026"
      ],
      "labelEnglishSource": "translation"
    },
    {
      "id": "2026-09-24-ceremony-graduation",
      "startDate": "2026-09-24",
      "endDate": "2026-09-24",
      "label": {
        "ja": "学位記授与式",
        "en": "Commencement Ceremony"
      },
      "category": "ceremony",
      "sourceIds": [
        "official-calendar-2026"
      ],
      "labelEnglishSource": "translation"
    },
    {
      "id": "2026-09-30-ceremony-entrance",
      "startDate": "2026-09-30",
      "endDate": "2026-09-30",
      "label": {
        "ja": "入学式",
        "en": "Entrance Ceremony"
      },
      "category": "ceremony",
      "sourceIds": [
        "official-calendar-2026"
      ],
      "labelEnglishSource": "translation"
    },
    {
      "id": "2026-05-23-campus-homecoming",
      "startDate": "2026-05-23",
      "endDate": "2026-05-23",
      "label": {
        "ja": "ホームカミングデイ in 大岡山",
        "en": "Homecoming Day in Ookayama"
      },
      "category": "other",
      "sourceIds": [
        "official-calendar-2026"
      ],
      "labelEnglishSource": "translation"
    },
    {
      "id": "2026-10-10-campus-festival",
      "startDate": "2026-10-10",
      "endDate": "2026-10-11",
      "label": {
        "ja": "大学祭",
        "en": "Campus Festival"
      },
      "category": "campus-festival",
      "sourceIds": [
        "official-calendar-2026"
      ],
      "labelEnglishSource": "translation"
    },
    {
      "id": "2027-03-26-ceremony-graduation",
      "startDate": "2027-03-26",
      "endDate": "2027-03-26",
      "label": {
        "ja": "学位記授与式",
        "en": "Commencement Ceremony"
      },
      "category": "ceremony",
      "sourceIds": [
        "official-calendar-2026"
      ],
      "labelEnglishSource": "translation"
    },
    {
      "id": "2027-02-25-general-selection",
      "startDate": "2027-02-25",
      "endDate": "2027-02-26",
      "label": {
        "ja": "一般選抜「前期日程」",
        "en": "General Selection (First-Stage Schedule)"
      },
      "category": "academic",
      "sourceIds": [
        "official-calendar-2026"
      ],
      "labelEnglishSource": "translation"
    }
  ]
}
